datetime,url,title,text,imgs
2024-10-24,https://ambcrypto.com/ethereum-fees-see-4-spike-as-l2-network-airdrop-causes-congestion/,Ethereum fees see $4 spike as L2 network airdrop causes congestion,"2min read after the dencun upgrade lowered ethereum fees, a recent surge in blob fees was triggered by a major l2 token airdrop. IMG_1 adewale olarinde saman waris posted: october 24, 2024 ethereum fees surged to over $4 recently. this was the third time since the ethereum upgrade that the fee surged. ethereum [eth] fees saw a significant reduction after the introduction of blobs through the dencun upgrade. the upgrade also lowered costs across layer 2 (l2) networks. however, recent activity has led to a surge in blob fees, primarily due to the airdrop of a new l2 network token. ethereum l2 blob fees spike data from dune analytics indicates that blob fees experienced a significant spike on october 22nd, climbing to over $4. this marks the third major spike since the dencun upgrade. the increase was linked to the airdrop for ethereum l2 network scroll, which distributed its governance token, scr, to users, causing a temporary surge in activity. IMG_2 blobs were introduced with the dencun upgrade, primarily aimed at reducing transaction costs on ethereum’s l2 networks. with the implementation of blobs and proto-danksharding, transaction fees on ethereum l2s dropped considerably as more transactions were offloaded from the ethereum mainnet to these secondary layers. what this spike means for l2s while the blob fee spike was driven by temporary network congestion from the airdrop, it highlighted how events like this can still create volatility in transaction fees. this is the third time blob fees have surged since their introduction. still, despite these occasional spikes, ethereum’s l2s continue to offer lower fees compared to the mainnet. the dencun upgrade, which focuses on reducing costs by utilizing blobs, has largely been successful in keeping ethereum l2 fees low. this recent spike is an exception, largely influenced by the heavy network activity surrounding the scroll token airdrop. how ethereum fees have trended despite the temporary spike in blob fees, ethereum fees have generally remained low since the dencun upgrade. the fees have dropped, particularly as more transactions have migrated to l2s. data from crypto fees indicates that the average daily fee in the past week was around $6.7 million, with the 24-hour fee at approximately $5.4 million. while the blob fee spike demonstrates that congestion can still occur during major network events, ethereum’s ongoing focus on reducing costs continues to benefit users and maintain lower transaction fees overall. home analysis scroll crypto turns bearish: heavy pressure on psychological $1 level? the adx and -di (yellow and red respectively) were well above the 20 mark to highlight a strong bearish trend in progress. IMG_3 IMG_4 IMG_5 akashnath s scroll crypto faced a swift rejection from the $1.4 zone. the psychological $1 level might see an influx of demand. scroll [scr] is a layer 2 scaling solution that leverages zkrollup technology to reduce transaction costs and increase throughput. it aims to enhance the ethereum [eth] network scalability, and the token began trading in october. IMG_6 the chart above showed that the rejection from $1.4 was quick. in the past 48 hours, the token has shed close to 30% in value. additionally, data from defillama showed that the total value locked (tvl) stood at $793 million at press time. this value is just over $200 million lower than the $995 million tvl it recorded on the 16th of october. this uptick in activity was driven by the airdrop farming ahead of the scroll token airdrop snapshot on the 19th of october. strong downward momentum for scroll crypto IMG_7 the money flow index was near the oversold territory in the 1-hour timeframe. it showed that there was heavy selling pressure in recent hours. the price action took on a bearish bias within a matter of hours on the 21st of october. the rejection from $1.4 saw prices plummet swiftly below the $1.28 and $1.19 support levels. additionally, the bulls tried to climb back above the $1.19 level to convert it back into a support zone but failed. is your portfolio green? check the scroll profit calculator since this latest rejection at $1.19, scr is down by 17%. the market structure and trend were intensely bearish on the hourly timeframe. the adx and -di (yellow and red respectively) were well above the 20 mark to highlight a strong bearish trend in progress. combined with the selling pressure, it appeared likely that the $1 level would give way soon. disclaimer: the information presented does not constitute financial, investment, trading, or other types of advice and is solely the writer’s opinion IMG_8 IMG_9 IMG_10 IMG_11 IMG_12 more articles by olivia stephanie 22 mins ago by ambcrypto team 51 mins ago by gladys makena 1 hour ago by ishika kumari 2 hours ago by kelvin murithi 3 hours ago by erastus chami 4 hours ago",225.png 226.png 227.png 228.png 229.png 230.png 231.png 232.png 233.png 234.png 235.png 236.png
2024-10-24,https://ambcrypto.com/scroll-crypto-turns-bearish-heavy-pressure-on-psychological-1-level/,Scroll crypto turns bearish: Heavy pressure on psychological $1 level?,"2min read the adx and -di (yellow and red respectively) were well above the 20 mark to highlight a strong bearish trend in progress. IMG_1 akashnath s saman waris posted: october 24, 2024 scroll crypto faced a swift rejection from the $1.4 zone. the psychological $1 level might see an influx of demand. scroll [scr] is a layer 2 scaling solution that leverages zkrollup technology to reduce transaction costs and increase throughput. it aims to enhance the ethereum [eth] network scalability, and the token began trading in october. IMG_2 the chart above showed that the rejection from $1.4 was quick. in the past 48 hours, the token has shed close to 30% in value. additionally, data from defillama showed that the total value locked (tvl) stood at $793 million at press time. this value is just over $200 million lower than the $995 million tvl it recorded on the 16th of october. this uptick in activity was driven by the airdrop farming ahead of the scroll token airdrop snapshot on the 19th of october. strong downward momentum for scroll crypto IMG_3 the money flow index was near the oversold territory in the 1-hour timeframe. it showed that there was heavy selling pressure in recent hours. the price action took on a bearish bias within a matter of hours on the 21st of october. the rejection from $1.4 saw prices plummet swiftly below the $1.28 and $1.19 support levels. additionally, the bulls tried to climb back above the $1.19 level to convert it back into a support zone but failed. is your portfolio green? check the scroll profit calculator since this latest rejection at $1.19, scr is down by 17%. the market structure and trend were intensely bearish on the hourly timeframe. the adx and -di (yellow and red respectively) were well above the 20 mark to highlight a strong bearish trend in progress. combined with the selling pressure, it appeared likely that the $1 level would give way soon. disclaimer: the information presented does not constitute financial, investment, trading, or other types of advice and is solely the writer’s opinion home polkadot polkadot’s rally to $6.20 looms, but one key condition must be met polkadot's rally to $6.20 looms, but one key condition must be met dot rally is incoming as metric suggests IMG_4 IMG_5 IMG_6 olayiwola dolapo dot was on the brink of a bullish breakout as it approached two critical support levels. however, the strength of the rebound at this support level will dictate how far dot can rally. over the past month, polkadot [dot] has been in a bearish trend, slipping by 2.73%. in the last 24 hours alone, it declined by 3.74%. while a minor drop from its current price is still possible, the stage is set for a potential rally. ambcrypto has analyzed the factors behind this anticipated move and what investors should watch for. dot set for major rally as key support levels near dot is approaching two critical support levels, positioning it for a potential significant rally. the first support lies at $4.218, while the second is the diagonal support line of the ascending channel. a positive reaction from the first support (marked in black) could trigger a minor rally. however, if dot bounces from the base of the bullish pattern, it’s likely to first rally to $4.93. breaking through this resistance could lead to an additional 27.39% surge, propelling dot to $6.285. IMG_7 a slight delay could occur if the support level of the pattern is breached, temporarily pausing dot’s upward momentum. market sentiment signals a bullish shift the relative strength index (rsi) has sharply declined to a reading of 49.99, placing it near the neutral zone. this suggests that dot may experience a further drop from its current level, possibly falling below the $4.218 support level as it seeks the ascending channel’s support line. rsi measures the speed and magnitude of price changes to determine an asset’s momentum, indicating in this case that dot could face additional declines in the short term. however, the money flow index (mfi), which tracks liquidity inflows and outflows, shows a healthy inflow for dot. if this trend continues, it points to the potential for a near-term rally. IMG_8 overall market activity remains bullish an analysis of market activity using the exchange netflow data from coinglass suggested that sentiment remained bullish. over the past week, the exchange netflow has stayed negative, with $3.04 million worth of dot withdrawn from exchanges. this indicated that more market participants were holding onto their assets for safekeeping rather than selling, which would typically exert downward pressure on the price. more articles by ambcrypto team 4 mins ago by olivia stephanie 34 mins ago 1 hour ago by gladys makena 2 hours ago by ishika kumari 3 hours ago by kelvin murithi 4 hours ago",237.png 238.png 239.png 240.png 241.png 242.png 243.png 244.png
2024-10-24,https://ambcrypto.com/polkadots-rally-to-6-20-looms-but-one-key-condition-must-be-met/,"Polkadot’s rally to $6.20 looms, but one key condition must be met","2min read dot rally is incoming as metric suggests IMG_1 olayiwola dolapo saman waris posted: october 24, 2024 dot was on the brink of a bullish breakout as it approached two critical support levels. however, the strength of the rebound at this support level will dictate how far dot can rally. over the past month, polkadot [dot] has been in a bearish trend, slipping by 2.73%. in the last 24 hours alone, it declined by 3.74%. while a minor drop from its current price is still possible, the stage is set for a potential rally. ambcrypto has analyzed the factors behind this anticipated move and what investors should watch for. dot set for major rally as key support levels near dot is approaching two critical support levels, positioning it for a potential significant rally. the first support lies at $4.218, while the second is the diagonal support line of the ascending channel. a positive reaction from the first support (marked in black) could trigger a minor rally. however, if dot bounces from the base of the bullish pattern, it’s likely to first rally to $4.93. breaking through this resistance could lead to an additional 27.39% surge, propelling dot to $6.285. IMG_2 a slight delay could occur if the support level of the pattern is breached, temporarily pausing dot’s upward momentum. market sentiment signals a bullish shift the relative strength index (rsi) has sharply declined to a reading of 49.99, placing it near the neutral zone. this suggests that dot may experience a further drop from its current level, possibly falling below the $4.218 support level as it seeks the ascending channel’s support line. rsi measures the speed and magnitude of price changes to determine an asset’s momentum, indicating in this case that dot could face additional declines in the short term. however, the money flow index (mfi), which tracks liquidity inflows and outflows, shows a healthy inflow for dot. if this trend continues, it points to the potential for a near-term rally. IMG_3 overall market activity remains bullish an analysis of market activity using the exchange netflow data from coinglass suggested that sentiment remained bullish. over the past week, the exchange netflow has stayed negative, with $3.04 million worth of dot withdrawn from exchanges. this indicated that more market participants were holding onto their assets for safekeeping rather than selling, which would typically exert downward pressure on the price. home bitcoin bitcoin mining difficulty hits ath: here’s how it could impact btc prices bitcoin mining difficulty hits ath: here's how it could impact btc prices bitcoin's mining difficulty has reached a new peak, driven by a rising hashrate as miners compete for rewards. IMG_4 IMG_5 IMG_6 adewale olarinde ann maria shibu bitcoin’s mining difficulty has reached an all-time high due to a surge in the network. btc has remained above the $67,000 price range. bitcoin [btc] mining difficulty has reached a record high, driven by a surge in the network’s hashrate. this increase occurs as bitcoin’s price rises, prompting miners to expand their operations to capitalize on the potential rewards. the higher mining difficulty is a reflection of the network’s growing security, but also presents challenges for miners as they face rising costs. rising hashrate signals bitcoin mining difficulty throughout 2024, bitcoin’s hashrate has been steadily increasing. as of mid-october, it reached a peak of 656.3 billion, indicating heightened mining activity on the network. a higher hashrate means more miners are joining the bitcoin network, competing for blocks. IMG_7 the primary motivation for miners is btc’s ongoing price rally, which has encouraged them to ramp up their computational power. with btc trading at around $67,193, the incentive to secure new blocks has grown. however, this has also led to an automatic adjustment in the network’s mining difficulty. bitcoin mining difficulty reaches new heights bitcoin mining difficulty has climbed to its highest level ever following the surge in hashrate. the network automatically adjusts mining difficulty every two weeks to ensure blocks are mined approximately every 10 minutes. as more miners join the network, competition intensifies, increasing difficulty and the costs associated with mining. IMG_8 for miners, this rise in difficulty means they need more computational power and higher energy costs to maintain profitability. while btc’s rising price provides potential rewards, it also raises the cost of securing those rewards, squeezing profit margins for many miners. miner fees see slight uptick, while bitcoin price holds steady alongside the rise in the bitcoin mining difficulty and hashrate, miner fees have shown a moderate increase. fees typically rise when there’s a surge in network activity, with miners prioritizing transactions that offer higher rewards. although miner fees have spiked during network congestion in 2024, block rewards continue to account for the bulk of miners’ income. IMG_9 despite these network adjustments, bitcoin’s price has remained relatively stable, currently trading at $67,193, down by 0.28%. the average true range (atr) indicator points to potential volatility in the short term, suggesting that btc’s price could see fluctuations as the mining ecosystem adjusts to the increased difficulty and network activity. as bitcoin mining difficulty and hashrate continue to climb, the interplay between miner profitability, fees, and btc’s price will be essential to monitor. more articles by ishika kumari 6 mins ago by kelvin murithi 1 hour ago by erastus chami 2 hours ago by benjamin njiri 3 hours ago by lennox gitonga 4 hours ago by akashnath s 5 hours ago",245.png 246.png 247.png 248.png 249.png 250.png 251.png 252.png 253.png
2024-10-24,https://ambcrypto.com/bitcoin-mining-difficulty-hits-ath-heres-how-it-could-impact-btc-prices/,Bitcoin mining difficulty hits ATH: Here’s how it could impact BTC prices,"2min read bitcoin’s mining difficulty has reached a new peak, driven by a rising hashrate as miners compete for rewards. IMG_1 adewale olarinde ann maria shibu posted: october 24, 2024 bitcoin’s mining difficulty has reached an all-time high due to a surge in the network. btc has remained above the $67,000 price range. bitcoin [btc] mining difficulty has reached a record high, driven by a surge in the network’s hashrate. this increase occurs as bitcoin’s price rises, prompting miners to expand their operations to capitalize on the potential rewards. the higher mining difficulty is a reflection of the network’s growing security, but also presents challenges for miners as they face rising costs. rising hashrate signals bitcoin mining difficulty throughout 2024, bitcoin’s hashrate has been steadily increasing. as of mid-october, it reached a peak of 656.3 billion, indicating heightened mining activity on the network. a higher hashrate means more miners are joining the bitcoin network, competing for blocks. IMG_2 the primary motivation for miners is btc’s ongoing price rally, which has encouraged them to ramp up their computational power. with btc trading at around $67,193, the incentive to secure new blocks has grown. however, this has also led to an automatic adjustment in the network’s mining difficulty. bitcoin mining difficulty reaches new heights bitcoin mining difficulty has climbed to its highest level ever following the surge in hashrate. the network automatically adjusts mining difficulty every two weeks to ensure blocks are mined approximately every 10 minutes. as more miners join the network, competition intensifies, increasing difficulty and the costs associated with mining. IMG_3 for miners, this rise in difficulty means they need more computational power and higher energy costs to maintain profitability. while btc’s rising price provides potential rewards, it also raises the cost of securing those rewards, squeezing profit margins for many miners. miner fees see slight uptick, while bitcoin price holds steady alongside the rise in the bitcoin mining difficulty and hashrate, miner fees have shown a moderate increase. fees typically rise when there’s a surge in network activity, with miners prioritizing transactions that offer higher rewards. although miner fees have spiked during network congestion in 2024, block rewards continue to account for the bulk of miners’ income. IMG_4 despite these network adjustments, bitcoin’s price has remained relatively stable, currently trading at $67,193, down by 0.28%. the average true range (atr) indicator points to potential volatility in the short term, suggesting that btc’s price could see fluctuations as the mining ecosystem adjusts to the increased difficulty and network activity. as bitcoin mining difficulty and hashrate continue to climb, the interplay between miner profitability, fees, and btc’s price will be essential to monitor. home bitcoin: why a dip to $66k might be necessary for btc’s next move bitcoin: why a dip to $66k might be necessary for btc's next move bitcoin poised to fill price gap, potential bullish continuation toward higher levels. IMG_5 IMG_6 IMG_7 lennox gitonga bitcoin poised to retrace to $66k before a bounce. global liquidity to potentially continue rising up to 2026. bitcoin [btc] was navigating a critical price range at press time, with market watchers anticipating its next move. the $66.8k to $67.1k zone on bitcoin’s profile chart shows fewer positions, indicating a price gap. historically, price tends to gravitate toward such gaps to fill them before continuing a trend. bitcoin’s path forward hinges on whether it fills this gap before pushing higher or retraces further to gather liquidity. IMG_8 btc heading towards a gap btc’s price action shows a slight correction after hitting the $70k level, a major milestone for the cryptocurrency. the retracement suggests that bitcoin is gathering momentum for its next leg up, but first, it may need to fill the gap in the $66.8k-$67.1k range. this zone lies below a key double bottom pattern on the 6-hour timeframe of the btc/usdt pair, reinforcing the potential for upward movement once the gap is filled. the weekly chart remains bullish, with the structure broken to the upside, indicating strong market support. IMG_9 traders are closely watching this price action, with many expecting bitcoin to hold at the $70k-$71k level, which would likely trigger a move into price discovery and a new all-time high. the filling of the gap in this price range could also act as a liquidity grab, allowing bitcoin to gather strength before making a decisive move higher. a successful breakout past $70k would signal the start of a new bullish phase, with bitcoin potentially entering uncharted territory. profitability and global m2 supply the bitcoin average profitability index further supports this outlook. currently, the index stands at 202%, meaning the price is more than double the realized price. historically, investors tend to start taking profits when this index rises above 300%, but for now, it suggests that the market is not yet in heavy profit-taking mode. this leaves room for btc to continue its upward trajectory after filling the price gap, with long-term holders still optimistic about higher price levels. IMG_10 in addition to these indicators, the global m2 money supply data offers insights into bitcoin’s broader potential. during previous bull cycles, such as in 2016-2017, the expansion of the m2 supply coincided with significant bitcoin price growth. in 2021, a similar expansion occurred, but external factors like the collapse of ftx and rising interest rates dampened bitcoin’s momentum. f the m2 supply continues to grow through mid-2026, as some analysts predict, this could provide additional liquidity to the market and extend bitcoin’s current cycle. IMG_11 more articles by erastus chami 54 mins ago by benjamin njiri 2 hours ago by lennox gitonga 3 hours ago by akashnath s 4 hours ago by adewale olarinde 5 hours ago",254.png 255.png 256.png 257.png 258.png 259.png 260.png 261.png 262.png 263.png 264.png
