datetime,url,title,text,imgs
2024-10-24,https://ambcrypto.com/litecoin-set-for-recovery-ltcs-36b-on-chain-activity-suggests/,Litecoin set for recovery? LTC’s $36B on-chain activity suggests…,"2min read litecoin’s on-chain activity has hit a yearly high with 512.8 million ltc moving over the past week IMG_1 gladys makena ann maria shibu posted: october 24, 2024 ltc has declined by 3.74% over the past week. despite the decline, litecoin’s on chain activity surges with 512.8 million moving on-chain. after a sustained decline, litecoin [ltc] saw a brief uptrend breaking out of a descending channel. however, since hitting a local high of $76, the altcoin has experienced a sharp decline. despite the dip on weekly charts, ltc’s on-chain activities have surged to a 17 months high. litecoin on-chain activities surge to 2023 levels according to intotheblock data, litecoin has experienced one of the most active weeks in the past year. IMG_2 as such, the litecoin blockchain has seen 512.8 million tokens move on-chain over the past week, amounting to $36.6 billion. such levels were last experienced in may 2023 with an average of $5 billion daily. based on this observation, it indicates that litecoin is continually active with many participants across various platforms. usually, a surge in on-chain activity points to increased adoption, signaling a higher demand for ltc. what it means for ltc price charts as observed above, ltc has experienced a high demand with a rise in chain activities. this suggests the altcoin is enjoying positive market sentiment. notably, the past week has seen ltc decline after enjoying a strong upswing.  in fact, as of this writing, ltc was trading at $68.81. this marked a 3.01% decline over the past day with the altcoin also dropping by 3.74% on weekly charts. prior to this, litecoin had been on an upward trajectory hiking by 2.47% over the past month. although the altcoin has declined over the past week, the overall market remains positive. IMG_3 for instance, +di of dmi at 23 sits above -di which is at 18. this suggests that the uptrend momentum still remains positive and is likely to continue. this phenomenon was further supported by a positive chaikin money flow (cmf) at 0.03. this signals a higher buying pressure suggesting that buyers are still dominant. IMG_4 looking further, the mvrv ratio z score 0f -0.3 suggests a good buying opportunity for long-term holders and investors to accumulate. thus, with the dip, buyers can enter the market which in turn increases buying pressure, thus driving prices up. IMG_5 additionally, litecoin’s total flows have declined from a high of 291.5k to a low of zero. this suggests that there are reduced flows into exchanges signaling holding behavior. therefore, investors are keeping their ltc off exchanges anticipating price appreciation. simply put, the surge in on-chain activities suggests that ltc is experiencing a high demand. with positive positive sentiment and investor favorability, ltc is well-positioned to reclaim, the monthly trend. therefore, if these conditions hold, will reclaim the $76 resistance level where it has faced multiple rejections. consequently, if the downside persists, ltc will find the next support at $63.4. home news kalshi data shows trump leading with 63.3% probability ahead of election 3min read critics such as mark cuban contend that foreign investments may skew the betting odds on platforms like polymarket. IMG_6 IMG_7 IMG_8 ishika kumari trump’s prediction market odds surged after his pro-crypto campaign and public appearances. kalshi’s data reflects trump’s strong position as the election approaches. as the u.s. presidential election draws closer, the race is intensifying with prediction markets showing significant movement. trump outpaces harris former president donald trump has taken the lead in major platforms like polymarket and kalshi, where his chances of winning have surged to over 60%. polymarket data now reflects a notable 26.5-point gap between trump and harris. this marks a jump from earlier predictions, which saw trump at 61.3%. his numbers reportedly spiked after a widely publicized appearance at a mcdonald’s in pennsylvania, a key battleground state where he enjoys strong support. as of the latest update, polymarket data indicates that trump is leading with 64.1% of the votes, while harris trails with 35.9%. IMG_9 conversely, kalshi reports trump at 60% and harris at 40%. IMG_10 this is all because of trump’s ongoing pro-crypto campaign that has been apparent from the beginning. however, it was only after the first presidential debate that his odds in the prediction markets started to decline, despite having led the field from the outset. all about the kalshi prediction platform so for those unaware, kalshi, a relatively new entrant in the election prediction space, has made significant strides since launching its contracts in october following a favorable court ruling against the commodity futures trading commission (cftc). despite its late start, kalshi has already surpassed $30 million in trading volume on its primary election contract. while this figure trails behind polymarket, which achieved around $40 million in its first month of presidential betting and recently crossed the $2 billion mark, kalshi’s position as a regulated platform gives it a distinct edge, having waited for the legal victory to enter the market. however, some critics, such as mark cuban, suggest that foreign investments may distort the betting odds, as u.s. citizens are officially barred from participating on these platforms. he said, “from all indications, most of the money coming into polymarket is foreign money, so i don’t think it’s an indication of anything.” kalshi vs polymarket yet, it’s important to note that kalshi’s platform shows republican nominee trump with a 14-point lead over democratic contender harris, but unlike its competitor polymarket, kalshi only allows u.s. nationals and permanent residents to participate, due to strict regulatory compliance. polymarket, on the other hand, bans u.s. traders yet lacks the stringent verification process of kalshi, operating with cryptocurrency-based bets. despite initial concerns that kalshi’s regulatory status might be a disadvantage, it has shielded the platform from accusations of foreign interference and manipulation, a challenge polymarket has faced. remarking on the same, co-founder tarek mansour emphasized this distinction in a detailed thread on x (formerly twitter), and said, IMG_11 as expected, he put it best when he concluded, “media claim: a few big whales are driving trump’s odds up. reality: the median bet size on harris is larger than the median bet size on donald trump. trump’s odds are not the result of a few people pushing the odds up. it’s the opposite.” more articles by ambcrypto team 26 mins ago by ishika kumari 2 hours ago by kelvin murithi 3 hours ago by erastus chami 4 hours ago by benjamin njiri 5 hours ago by lennox gitonga 6 hours ago",114.png 115.png 116.png 117.png 118.png 119.png 120.png 121.png 122.png 123.png 124.png
2024-10-24,https://ambcrypto.com/kalshi-data-shows-trump-leading-with-63-3-probability-ahead-of-election/,Kalshi data shows Trump leading with 63.3% probability ahead of election,"3min read critics such as mark cuban contend that foreign investments may skew the betting odds on platforms like polymarket. IMG_1 ishika kumari ann maria shibu posted: october 24, 2024 trump’s prediction market odds surged after his pro-crypto campaign and public appearances. kalshi’s data reflects trump’s strong position as the election approaches. as the u.s. presidential election draws closer, the race is intensifying with prediction markets showing significant movement. trump outpaces harris former president donald trump has taken the lead in major platforms like polymarket and kalshi, where his chances of winning have surged to over 60%. polymarket data now reflects a notable 26.5-point gap between trump and harris. this marks a jump from earlier predictions, which saw trump at 61.3%. his numbers reportedly spiked after a widely publicized appearance at a mcdonald’s in pennsylvania, a key battleground state where he enjoys strong support. as of the latest update, polymarket data indicates that trump is leading with 64.1% of the votes, while harris trails with 35.9%. IMG_2 conversely, kalshi reports trump at 60% and harris at 40%. IMG_3 this is all because of trump’s ongoing pro-crypto campaign that has been apparent from the beginning. however, it was only after the first presidential debate that his odds in the prediction markets started to decline, despite having led the field from the outset. all about the kalshi prediction platform so for those unaware, kalshi, a relatively new entrant in the election prediction space, has made significant strides since launching its contracts in october following a favorable court ruling against the commodity futures trading commission (cftc). despite its late start, kalshi has already surpassed $30 million in trading volume on its primary election contract. while this figure trails behind polymarket, which achieved around $40 million in its first month of presidential betting and recently crossed the $2 billion mark, kalshi’s position as a regulated platform gives it a distinct edge, having waited for the legal victory to enter the market. however, some critics, such as mark cuban, suggest that foreign investments may distort the betting odds, as u.s. citizens are officially barred from participating on these platforms. he said, “from all indications, most of the money coming into polymarket is foreign money, so i don’t think it’s an indication of anything.” kalshi vs polymarket yet, it’s important to note that kalshi’s platform shows republican nominee trump with a 14-point lead over democratic contender harris, but unlike its competitor polymarket, kalshi only allows u.s. nationals and permanent residents to participate, due to strict regulatory compliance. polymarket, on the other hand, bans u.s. traders yet lacks the stringent verification process of kalshi, operating with cryptocurrency-based bets. despite initial concerns that kalshi’s regulatory status might be a disadvantage, it has shielded the platform from accusations of foreign interference and manipulation, a challenge polymarket has faced. remarking on the same, co-founder tarek mansour emphasized this distinction in a detailed thread on x (formerly twitter), and said, IMG_4 as expected, he put it best when he concluded, “media claim: a few big whales are driving trump’s odds up. reality: the median bet size on harris is larger than the median bet size on donald trump. trump’s odds are not the result of a few people pushing the odds up. it’s the opposite.” home ethereum classic ethereum classic: can etc’s high social interest translate to a market rally? ethereum classic: can etc's high social interest translate to a market rally? 2min read etc tests key support as whale activity and social dominance surge. IMG_5 IMG_6 IMG_7 kelvin murithi etc social dominance and whale activity surge signals a potential reversal. a key symmetrical triangle support level could push etc into bullish territory. ethereum classic [etc] is at a crucial price level. the altcoin has dipped by 8% in the last 48 hours, leading it to test a critical support level within a symmetrical triangle pattern. ethereum classic [etc] is at a crucial price level. the altcoin has dipped by 8% in the last 48 hours, leading it to test a critical support level within a symmetrical triangle pattern. this might just be the ideal setting for an impending reversal, especially amidst a significant increase in whale activities and social dominance. etc social dominance hits new highs etc social dominance is at an all-time high since 14th july and seems to be rising. such spikes in visibility indicate an increasing interest and attention by the community, which has often correlated with price action. as the crypto market is heavily influenced by sentiment,  the rise in etc social dominance could hint at building momentum. the convergence of strong technical levels and this social activity becomes even more significant. IMG_8 whale activity suggests institutional interest adding to the increasing social activity, the altcoin whale activity is also on the rise. the percentage of total supply held by whales with over 5 million etc has surged to an impressive 58%. adding to the increasing social activity, the altcoin whale activity is also on the rise. the percentage of total supply held by whales with over 5 million etc has surged to an impressive 58%. this accumulation by big market players often precedes significant price movements. whales growing positions indicate confidence in etc’s potential to break through its current consolidation and possibly reverse its recent downtrend. this accumulation by big market players often precedes significant price movements. whales growing positions indicate confidence in etc’s potential to break through its current consolidation and possibly reverse its recent downtrend. IMG_9 symmetrical triangle hints at possible breakout etc’s price has been consolidating within a symmetrical triangle—a pattern known for signaling potential breakouts in either direction—since 24th august. with the price testing a key support level at around $18, the next move could determine whether ethereum classic will bounce higher or continue its downward trajectory. however, with both social dominance and whale activity flashing bullish signals,  etc could be building momentum for an upside reversal. if the support holds, etc may rally to break out of this pattern and push toward higher price levels. IMG_10 with whale activity  and social activity surging to the upside, etc now seems very well-placed for a possible change in trend. while no pattern confirms a breakout, the signs point to growing bullish sentiment. more articles by ambcrypto team 26 mins ago by gladys makena 56 mins ago by kelvin murithi 3 hours ago by erastus chami 4 hours ago by benjamin njiri 5 hours ago by lennox gitonga 6 hours ago",125.png 126.png 127.png 128.png 129.png 130.png 131.png 132.png 133.png 134.png
2024-10-24,https://ambcrypto.com/ethereum-classic-can-etcs-high-social-interest-translate-to-a-market-rally/,Ethereum Classic: Can ETC’s high social interest translate to a market rally?,"2min read etc tests key support as whale activity and social dominance surge. IMG_1 kelvin murithi ann maria shibu posted: october 24, 2024 etc social dominance and whale activity surge signals a potential reversal. a key symmetrical triangle support level could push etc into bullish territory. ethereum classic [etc] is at a crucial price level. the altcoin has dipped by 8% in the last 48 hours, leading it to test a critical support level within a symmetrical triangle pattern. ethereum classic [etc] is at a crucial price level. the altcoin has dipped by 8% in the last 48 hours, leading it to test a critical support level within a symmetrical triangle pattern. this might just be the ideal setting for an impending reversal, especially amidst a significant increase in whale activities and social dominance. etc social dominance hits new highs etc social dominance is at an all-time high since 14th july and seems to be rising. such spikes in visibility indicate an increasing interest and attention by the community, which has often correlated with price action. as the crypto market is heavily influenced by sentiment,  the rise in etc social dominance could hint at building momentum. the convergence of strong technical levels and this social activity becomes even more significant. IMG_2 whale activity suggests institutional interest adding to the increasing social activity, the altcoin whale activity is also on the rise. the percentage of total supply held by whales with over 5 million etc has surged to an impressive 58%. adding to the increasing social activity, the altcoin whale activity is also on the rise. the percentage of total supply held by whales with over 5 million etc has surged to an impressive 58%. this accumulation by big market players often precedes significant price movements. whales growing positions indicate confidence in etc’s potential to break through its current consolidation and possibly reverse its recent downtrend. this accumulation by big market players often precedes significant price movements. whales growing positions indicate confidence in etc’s potential to break through its current consolidation and possibly reverse its recent downtrend. IMG_3 symmetrical triangle hints at possible breakout etc’s price has been consolidating within a symmetrical triangle—a pattern known for signaling potential breakouts in either direction—since 24th august. with the price testing a key support level at around $18, the next move could determine whether ethereum classic will bounce higher or continue its downward trajectory. however, with both social dominance and whale activity flashing bullish signals,  etc could be building momentum for an upside reversal. if the support holds, etc may rally to break out of this pattern and push toward higher price levels. IMG_4 with whale activity  and social activity surging to the upside, etc now seems very well-placed for a possible change in trend. while no pattern confirms a breakout, the signs point to growing bullish sentiment. more articles by gladys makena 4 mins ago by ishika kumari 1 hour ago by erastus chami 3 hours ago by benjamin njiri 4 hours ago by lennox gitonga 5 hours ago by akashnath s 6 hours ago",135.png 136.png 137.png 138.png
2024-10-24,https://ambcrypto.com/can-qnt-surge-beyond-70-price-charts-show/,Can QNT surge beyond $70? Price charts show…,"2min read quant is approaching a breakout, with bullish momentum building despite increased selling pressure. IMG_1 erastus chami ann maria shibu posted: october 24, 2024 qnt is consolidating within a descending wedge, with technical indicators signaling potential upward movement. despite bullish sentiment, rising exchange reserves could introduce selling pressure and limit upside. quant [qnt] has been stuck in a descending wedge pattern since mid-march, with its price constrained between $60 and $70 for months. however, recent consolidation near $64.2 signals that a breakout may be imminent. quant [qnt] has been stuck in a descending wedge pattern since mid-march, with its price constrained between $60 and $70 for months. however, recent consolidation near $64.2 signals that a breakout may be imminent. both crowd and smart money sentiment are turning bullish, raising the question: can qnt break out of its downtrend and surge toward higher resistance levels? qnt’s descending wedge: is a reversal on the horizon? the descending wedge is a common bullish reversal pattern, and with qnt consolidating around $63.6 at press time, the market is closely watching for a potential breakout. a breakout above the key resistance levels around $70 could open the door to a rally toward $120. however, this will depend on whether quant can gather enough buying pressure to break free from the wedge and push higher. additionally, the narrowing range indicates a tightening price action, which historically precedes significant moves. IMG_2 bollinger bands and rsi: is momentum building? the technical indicators offer further insight into quant’s situation. the bollinger bands are tightening, showing reduced volatility, while the relative strength index (rsi) sits at 42.67, just above oversold territory. consequently, the rsi suggests that there is still room for a potential upward movement. historically, when these two indicators align, a breakout often follows. however, traders must be cautious, as false breakouts can occur without sufficient volume and momentum. IMG_3 exchange reserves: is selling pressure increasing? on-chain data reveals a slight uptick in exchange reserves, rising by 0.22% to 1.5487 million quant in the last 24 hours. an increase in exchange reserves often signals growing selling pressure, as more tokens are being moved to exchanges. therefore, this could limit the potential upside in the short term if selling intensifies. additionally, qnt needs to overcome this selling pressure to maintain its bullish trajectory. IMG_4 liquidations: market stability or risk? liquidation data shows that there has been minimal long liquidation activity, with only $2.91k worth of longs liquidated. consequently, the market remains relatively stable, with low leverage, which reduces the risk of forced selling. however, should qnt experience a sharp price move, liquidations could rise quickly, potentially amplifying volatility. will qnt break out? with sentiment turning bullish and technical indicators suggesting a possible breakout, qnt appears to be positioned for a potential upward move. however, rising exchange reserves indicate that sellers could weigh on any price surge. if qnt can clear resistance levels and maintain its momentum, it could test higher levels, possibly reaching $120. home ripple bitboy crypto foresees xrp flipping eth by 2025 – here’s why bitboy crypto foresees xrp flipping eth by 2025 - here's why here's why bitboy believe xrp could flip eth by 2025 and front a 30x price rally to $15.6. IMG_5 IMG_6 IMG_7 benjamin njiri saman waris according to bitboy crypto, xrp could flip eth in market cap by 2025. bitboy crypto projected that xrp rice could surge 20x-30x, hitting a high of $15.6 or more. ripple [xrp] could flip ethereum [eth] in market cap by 2025, according to market watcher ben armstrong, popularly known as bitboy crypto. ripple [xrp] could flip ethereum [eth] in market cap by 2025, according to market watcher ben armstrong, popularly known as bitboy crypto. bitboy crypto cited 2018’s xrp remarkable performance, which saw it rank 2nd on coinmarketcap, while eth came in third in market size. bitboy crypto cited 2018’s xrp remarkable performance, which saw it rank 2nd on coinmarketcap, while eth came in third in market size. “xrp had already flipped eth before. on january 8 2018, it was the last altcoin season push, just two weeks after btc topped.” IMG_8 at that time, xrp’s market size was $130 billion, while eth’s was $111 billion. bitboy projected a similar play in 2025, as the overall market expects the current btc cycle to top in 2025. at that time, xrp’s market size was $130 billion, while eth’s was $111 billion. bitboy projected a similar play in 2025, as the overall market expects the current btc cycle to top in 2025. “in 2018, $xrp already flipped ethereum once. and in 2025, it’s going to happen again. get ready for the next bull run. $xrp army knows what’s coming.” can xrp flip eth? according to armstrong, eth could struggle to overcome the psychological resistance of a $1 trillion market size due to competition in the layer 1 space. according to his analysis, eth might 3x and falter around $940 billion. on the contrary, bitboy projected that xrp could expand 20x from current levels, hitting a market cap of $600 billion. this could bring the price to $11. he said, “a 20x could bring xrp price to $11. all it takes for xrp eth flipping at this point is eth to top before xrp and be on the way down as xrp rises to the top.” he reiterated that the flipping could happen if xrp does a 25x-30x. that would translate to an xrp rally to $13 — $15.6 from the current $0.52 value. however, he mentioned that the ripple labs lawsuit was a key roadblock to the xrp price rally. in fact, he estimated that xrp could have flipped eth in 2021 if not for the lawsuit. however, he mentioned that the ripple labs lawsuit was a key roadblock to the xrp price rally. in fact, he estimated that xrp could have flipped eth in 2021 if not for the lawsuit. the price chart for the xrp/eth ratio, which tracks xrp’s relative performance to eth, echoed his sentiment to some extent. eth outperformed xrp in early 2024 as the lawsuit dragged on. IMG_9 however, a partial victory against the sec towards h2 2024 tipped the scales for xrp to temporarily outperform eth. it rallied 86% against eth between may and august, marking a significant outperformance against the largest altcoin. whether the rally will continue towards the next target at 0.0003 remains to be seen. that said, xrp sank towards $0.50 at press time. since the lawsuit was still in play, the altcoin could face headwinds in the short-term. IMG_10 more articles by ishika kumari 37 seconds ago by kelvin murithi 1 hour ago by benjamin njiri 3 hours ago by lennox gitonga 4 hours ago by akashnath s 5 hours ago by erastus chami 6 hours ago",139.png 140.png 141.png 142.png 143.png 144.png 145.png 146.png 147.png 148.png
