datetime,url,title,text,imgs
2024-10-24,https://ambcrypto.com/bitboy-crypto-foresees-xrp-flipping-eth-by-2025-heres-why/,BitBoy Crypto foresees XRP flipping ETH by 2025 – Here’s why,"2min read here’s why bitboy believe xrp could flip eth by 2025 and front a 30x price rally to $15.6. IMG_1 benjamin njiri saman waris posted: october 24, 2024 according to bitboy crypto, xrp could flip eth in market cap by 2025. bitboy crypto projected that xrp rice could surge 20x-30x, hitting a high of $15.6 or more. ripple [xrp] could flip ethereum [eth] in market cap by 2025, according to market watcher ben armstrong, popularly known as bitboy crypto. ripple [xrp] could flip ethereum [eth] in market cap by 2025, according to market watcher ben armstrong, popularly known as bitboy crypto. bitboy crypto cited 2018’s xrp remarkable performance, which saw it rank 2nd on coinmarketcap, while eth came in third in market size. cited 2018’s xrp remarkable performance, which saw it rank 2nd on coinmarketcap, while eth came in third in market size. “xrp had already flipped eth before. on january 8 2018, it was the last altcoin season push, just two weeks after btc topped.” IMG_2 at that time, xrp’s market size was $130 billion, while eth’s was $111 billion. bitboy projected a similar play in 2025, as the overall market expects the current btc cycle to top in 2025. at that time, xrp’s market size was $130 billion, while eth’s was $111 billion. bitboy projected a similar play in 2025, as the overall market expects the current btc cycle to top in 2025. “in 2018, $xrp already flipped ethereum once. and in 2025, it’s going to happen again. get ready for the next bull run. $xrp army knows what’s coming.” can xrp flip eth? according to armstrong, eth could struggle to overcome the psychological resistance of a $1 trillion market size due to competition in the layer 1 space. according to his analysis, eth might 3x and falter around $940 billion. on the contrary, bitboy projected that xrp could expand 20x from current levels, hitting a market cap of $600 billion. this could bring the price to $11. he said, “a 20x could bring xrp price to $11. all it takes for xrp eth flipping at this point is eth to top before xrp and be on the way down as xrp rises to the top.” he reiterated that the flipping could happen if xrp does a 25x-30x. that would translate to an xrp rally to $13 — $15.6 from the current $0.52 value. however, he mentioned that the ripple labs lawsuit was a key roadblock to the xrp price rally. in fact, he estimated that xrp could have flipped eth in 2021 if not for the lawsuit. however, he mentioned that the ripple labs lawsuit was a key roadblock to the xrp price rally. in fact, he estimated that xrp could have flipped eth in 2021 if not for the lawsuit. the price chart for the xrp/eth ratio, which tracks xrp’s relative performance to eth, echoed his sentiment to some extent. eth outperformed xrp in early 2024 as the lawsuit dragged on. IMG_3 however, a partial victory against the sec towards h2 2024 tipped the scales for xrp to temporarily outperform eth. it rallied 86% against eth between may and august, marking a significant outperformance against the largest altcoin. whether the rally will continue towards the next target at 0.0003 remains to be seen. that said, xrp sank towards $0.50 at press time. since the lawsuit was still in play, the altcoin could face headwinds in the short-term. IMG_4 more articles IMG_5 by lennox gitonga 1 hour ago IMG_6 by akashnath s 2 hours ago IMG_7 by erastus chami 3 hours ago IMG_8 by adewale olarinde IMG_9 by benjamin njiri 4 hours ago IMG_10 by muthoni mary 5 hours ago",149.png 150.png 151.png 152.png 153.png 154.png 155.png 156.png 157.png 158.png
2024-10-24,https://ambcrypto.com/chainlink-nears-breakout-is-links-surge-to-50-coming/,Chainlink nears breakout: Is LINK’s surge to $50 coming?,"2min read chainlink nears breakout, boosted by whale activity and expanding real-world asset integration. IMG_1 lennox gitonga saman waris posted: october 24, 2024 chainlink preparing for a breakout. whales are accumulating link as end of year nears. chainlink [link] neared a potential breakout as it approached a critical point in the market. at press time, link was trading within a falling wedge pattern on the weekly timeframe, and many traders anticipated a significant upward movement soon. these developments could push link’s price higher as it became an even more vital player in the crypto world. link price action and prediction looking at recent price action, chainlink has gained around 0.5% over the past week. however, the last 24 hours saw a decline of 5.6%. despite the short-term losses, link’s trading volume surged by over 10%, with approximately $290 million changing hands. the volume-to-market-cap ratio sat at 4%, indicating sufficient liquidity to support continued trading activity. as link moves toward a possible breakout, all eyes are on the $15 level. if link can break and hold above this resistance, it could trigger a rally that targets $50 by next year. IMG_2 link is currently trading below the 50-day moving average, and flipping this level could reignite bullish momentum. traders are closely watching for this signal, as it could confirm a breakout from the falling wedge pattern. if the breakout occurs, link could see a strong move higher, making it a top contender in the crypto market during the final quarter of the year. whale orders and large trades large trades and whale orders are offering further clues about link’s future direction. on the k-line chart, large trades appear as circles, with the size representing the trade amount. whale orders are marked by horizontal lines, with chainlink’s big orders concentrated around the $11 zone. these trades suggest that large investors are positioning themselves for a move higher, as whales typically accumulate when they expect a price increase. the longer these orders remain unfilled, the more likely it is that they will drive link’s price higher. IMG_3 link expanding into rwa and ai chainlink’s expansion into real-world assets (rwa) and artificial intelligence (ai) is also setting the stage for a significant price boost. chainlink’s role as a provider of secure oracles for smart contracts positions it perfectly for the upcoming tokenization of rwas. as major financial players like blackrock explore tokenizing stocks, bonds, and real estate, chainlink could become a central infrastructure for these assets. this integration could absorb massive amounts of liquidity into link, further driving its price higher. chainlink is at a pivotal moment. if link holds key support levels and breaks above $15, the sky may be the limit. more articles by akashnath s 1 hour ago IMG_4 by erastus chami 2 hours ago IMG_5 by adewale olarinde IMG_6 by benjamin njiri 3 hours ago by muthoni mary 4 hours ago",159.png 160.png 161.png 162.png 163.png 164.png
2024-10-24,https://ambcrypto.com/xrp-ledger-liquidity-deposits-rise-but-altcoin-faces-resistance-whats-next/,"XRP Ledger liquidity deposits rise, but altcoin faces resistance – What’s next?","2min read the strong rise in ammdeposit and ammcreate reflected a rise in liquidity deposits. IMG_1 akashnath s saman waris posted: october 24, 2024 the insights into the xrp ledger made for a bullish reading. the price action chart was quick to sink these hopes. ripple [xrp] was still in a consolidation phase. the price clung to the $0.52 support level, and whale activity did little to push prices higher. news that a whale withdrew 52 million xrp worth $28.67 million from bybit did not help sentiment or induce bullish momentum. in other news, elon musk, ceo and founder of tesla and spacex and owner of x (formerly twitter) was asked about xrp adoption by financial institutions. xrp ledger showed encouraging stats IMG_2 the daily xrp price chart was not bullish. the market structure was strongly bearish, and the sharp price drop in early october left behind a large imbalance to the north. therefore, though xrp is expected to bounce toward the local highs at $0.62-$0.66 next, there would be significant selling pressure. in a post on cryptoquant, wenry seoul, marketing manager at catalyze research, noted that the xrp ledger had a daily transaction volume comparable to layer 1 networks. this is based on the activity between the 15th of september to the 15th of october. the decentralized exchange activity metrics showed the number of trades dropped by 6.83%, from 6.88 million to 6.41 million. even so, the dex volume went up by 17.64% to $4.6 million. in terms of automated market maker (amm) liquidity provision, there was significant growth. ammdeposit’s purpose is to deposit funds into an existing amm instance, while ammcreate is used to create a new instance for trading a pair of assets. the strong rise in ammdeposit and ammcreate reflected a rise in liquidity deposits and is a sign of escalating confidence. network growth surpasses three-month highs IMG_3 the transaction count trended higher from the 7th to the 20th of october but has begun to falter. the rapid network growth is particularly encouraging because it could spur demand. this could help the token’s bulls defend the key support level at $0.52. however, based on the price action, a sweep of the $0.508 zone might be necessary before a rally toward $0.62. home altcoin celestia targets $6.9 as market confidence rises: what’s next for tia? celestia targets $6.9 as market confidence rises: what's next for tia? celestia’s breakout is drawing attention as it approaches a critical resistance at $6.9. IMG_4 IMG_5 IMG_6 erastus chami celestia has broken out of its descending channel, targeting $6.9 as the next resistance. rising social dominance and increased open interest signal growing market confidence in tia. celestia [tia] has gained notable traction after successfully breaking out of its descending channel, positioning itself for a potential bullish run. celestia [tia] has gained notable traction after successfully breaking out of its descending channel, positioning itself for a potential bullish run. trading at $5.97 at press time with a 4.39% gain, analysts are eyeing whether tia can sustain this momentum. however, the token now faces a critical test: can it push past the next major resistance level of $6.9 and trigger a larger rally? tia descending channel breakout the breakout from the descending channel, which has been forming for several months, has sparked optimism in the market. celestia now confronts key resistance at $6.9, which, if cleared, could lead to an extended rally. a further breakout could target $11.9 as the next major price level. however, failing to hold above $6.9 might see tia fall back to its earlier consolidation zone. therefore, the coming days will be crucial as traders closely monitor these levels. IMG_7 tia technical analysis: rsi and macd turning to technical indicators, the relative strength index (rsi) sits at 55.19, reflecting a balanced but slightly bullish market. however, it still remains below the overbought threshold, indicating that celestia has room to move higher without hitting exhaustion. additionally, the macd indicator is on the verge of a bullish crossover, which could further propel celestia upward. both indicators suggest that the token has potential to extend its gains if current trends continue. IMG_8 social dominance and market sentiment in the world of cryptocurrency, social sentiment can significantly impact price movement. recently, tia’s social dominance reached 0.049%, showing that it’s slowly gaining traction among retail investors. although this number is relatively modest, an increase in social activity often coincides with a surge in retail interest, which could consequently support further price appreciation. therefore, tia’s growing visibility could enhance its bullish momentum if more traders start discussing and investing in the token. IMG_9 open interest and market confidence open interest for tia futures currently stands at $317.32 million, marking a 0.66% increase. this rise suggests that traders are gaining confidence in the token’s short-term performance. a higher open interest usually reflects increased trader participation and could bolster market momentum. this uptick in futures interest adds another layer of optimism around tia’s breakout. IMG_10 is your portfolio green? check out the tia profit calculator conclusively, celestia’s technical setup and rising market interest indicate that it is well-positioned for further gains. however, breaking through the $6.9 resistance is essential for the token to sustain its bullish momentum. should tia successfully clear this hurdle, it could target higher levels like $11.9. more articles by erastus chami 34 mins ago by adewale olarinde 1 hour ago by benjamin njiri 2 hours ago by muthoni mary 3 hours ago by chanakya 4 hours ago",165.png 166.png 167.png 168.png 169.png 170.png 171.png 172.png 173.png 174.png
2024-10-24,https://ambcrypto.com/shib-burns-300m-tokens-what-does-it-mean-for-shiba-inu-investors/,SHIB burns +300M tokens: What does it mean for Shiba Inu investors?,"2min read the recent shib burns have surged significantly, with over 300 million tokens burned in just a week. despite this, price has continued its downtrend. IMG_1 adewale olarinde ann maria shibu posted: october 24, 2024 over 300 million shib tokens were burned in the past week, marking a 1,000% increase in the burn rate. the burn rate has increased by over 6,000% in the last 24 hours. the shiba inu [shib] burns in the past saw a notable spike, with over 300 million tokens burned. in the last 24 hours, the burns have also increased significantly even as the shiba inu price continues to decline. shib burns spike with over 300 million tokens over 300 million shiba inu tokens were burned in the past week. according to the latest data, more than 324 million tokens were removed from circulation, marking an increase of over 1,000% compared to the previous week. the burning activity has remained strong, with a 6,700% surge in the past 24 hours alone. during this period, an additional 27 million shib tokens were burned, pushing the total number of burned tokens to approximately 410.7 trillion. despite the substantial burns, this figure remains small compared to shiba inu’s total supply. address activity remains steady despite shib burns while shib burns have increased, analysis shows no significant uptick in shiba inu address activity. according to data from santiment, the seven-day active addresses have stayed steady, hovering around 20,000. on october 21st, there was a slight spike to over 21,000 addresses, but it quickly returned to its regular levels. IMG_2 similarly, the number of daily active addresses has shown little movement, remaining between 3,700 and 3,800 recently. like the seven-day data, the daily active addresses slightly increased on 21st october, surpassing 3,900. however, this modest change did not correspond with the surge in shib burns. the stable address activity suggests that the increased burning of tokens is not driven by a rise in active users on the network. it also indicates that the recent burns are not necessarily linked to any transactions or on-chain activity spike. shiba inu continues to trend downward shiba inu’s price has continued to trend downward over the past few days despite the spike in shib burns. the price decline started with a 3% drop and has now fallen by another 1.7%. this indicates that the increased shib burns does not have a direct or positive correlation with shib’s market price at the moment. IMG_3 although the relative strength index (rsi) suggests that shiba inu is still in a bullish trend, the weakening rsi shows that this trend is losing momentum. is your portfolio green? check out the shiba inu profit calculator currently, the rsi hovers near the neutral line, reflecting market uncertainty. while shib burns continues reducing the circulating supply, they have yet to influence price or address activity significantly. the ongoing downward trend in shiba inu’s price suggests that other factors are currently driving market sentiment. more articles by benjamin njiri 1 hour ago by muthoni mary 2 hours ago by chanakya 3 hours ago by kamina gilani 4 hours ago by adewale olarinde",175.png 176.png 177.png
2024-10-24,https://ambcrypto.com/bitcoin-etf-options-divide-analysts-with-all-due-respect/,Bitcoin ETF options divide analysts – ‘With all due respect…’,"2min read here’s analysts’ views after sec approved more us spot btc etfs options. IMG_1 benjamin njiri jacob thomas posted: october 24, 2024 analysts agreed u.s. btc options could inject more liquidity into btc markets. but, there were divided views on volatility and price impact in the long run. market commentaries have piled in as the regulator approved more u.s. spot bitcoin [btc] etf options. market commentaries have piled in as the regulator approved more u.s. spot bitcoin [btc] etf options. on the 18th of october, the u.s. securities and exchange commission (sec) gave a go-ahead for the products on the nyse (new york stock exchanges) and cboe (chicago board options exchange). on the 18th of october, the u.s. securities and exchange commission (sec) gave a go-ahead for the products on the nyse (new york stock exchanges) and cboe (chicago board options exchange). nyse american got the green light to offer options for fidelity’s btc fund, fbtc, and ark 21shares’ arkb. meanwhile, cboe will trade grayscale’s gbtc, mini btc, and bitwise’s btib. this approval follows the recent clearance of blackrock’s ibit options. so, what’s the potential impact on the btc market and price? mixed views on u.s. btc etf options according to some analysts, this could set the pace for extra volatility and more liquidity in bitcoin. for context, options allow professional traders to speculate and employ risk management (hedging) strategies without owning the underlying btc asset. last month, after ibit options approval, anthony pompiliano, a btc investor, stated that it would reduce btc volatility and limit its upside potential. last month, after ibit options approval, anthony pompiliano, a btc investor, stated that it would reduce btc volatility and limit its upside potential. “the approval of options on blackrock’s bitcoin etf will bring more institutional adoption of the asset, which will lower volatility & limit the explosive upside of bitcoin.” however, bitwise’s jeff park viewed the approval as a net positive for btc volatility, liquidity, and price. he countered what he felt was a flawed take on the u.s. btc etf options. however, bitwise’s jeff park viewed the approval as a net positive for btc volatility, liquidity, and price. he countered what he felt was a flawed take on the u.s. btc etf options. IMG_2 park’s sentiment was shared by most analysts who shared their views with the block. ed tolson, ceo of kbit, stated, “institutional market makers, who are expected to take the other side of these trades, will likely be short gamma. this means they may need to buy as the price rises and sell as it falls, potentially amplifying volatility.” however, michael harvey, head of franchise trading at galaxy digital, projected a short-term spike in volatility, which could be reduced in the long run. “we expect retail traders to outnumber institutions initially, which could elevate volatility. over time, as institutions adopt yield-generation strategies, such as selling volatility, this could dampen the overall volatility we see today.” harvey’s outlook on volatility mirrored pompiliano’s projection. in conclusion, analysts were confident that the approval would inject more liquidity into btc markets. however, there were mixed takes on volatility and price impact in the short and long term. home solana solana network usage hits record highs – will this help sol reach $200? solana network usage hits record highs - will this help sol reach $200? solana is on track to becoming the second-largest network by defi tvl IMG_3 IMG_4 IMG_5 muthoni mary solana daily active addresses have jumped to record highs amid rising defi activity. solana defi tvl has also reached a 34-month high of $6.48 billion. solana [sol] has gained by 7% in the last seven days and 16% in the last two weeks to trade at $165 at press time. solana [sol] has gained by 7% in the last seven days and 16% in the last two weeks to trade at $165 at press time. while the bullish trend across the broader cryptocurrency market aided sol’s recovery, network growth has also been a catalyst behind the recent gains. data from token terminal shows that solana’s daily active addresses have been on a gradual rise, and currently stand at all-time highs. this shows positive sentiment towards solana as users trade sol or interact with the decentralized applications (dapps) created on the blockchain. the daily revenues on solana also recently spiked to $2m, the highest level in six months, underscoring the rising demand for the blockchain. IMG_6 will solana flip tron by defi tvl? one of the sectors where the solana network is seeing rising usage is decentralized finance (defi). data from defillama shows solana’s defi total value locked (tvl) is at a 34-month high of $6.48 billion. one of the sectors where the solana network is seeing rising usage is decentralized finance (defi). data from defillama shows solana’s defi total value locked (tvl) is at a 34-month high of $6.48 billion. at the same time, tron (trx) tvl has dropped to $6.94 billion. if solana’s tvl continues to increase, the network could flip tron and become the second-largest blockchain by this metric. solana defi revenues have also increased to the highest level since march, further showing rising usage. IMG_7 the growth of a blockchain network is often viewed as bullish and could fuel a price rally. furthermore, several technical indicators show that despite the recent pullback, sol’s uptrend is gaining strength. technical indicators show bullish signs at its current price, sol is 36% shy of its all-time highs, and several bullish signs are aligning that could see sol break $200 and aim for a new record high. solana is trading within an ascending parallel channel on the one-day chart, which confirms that a bullish trend is in play. the altcoin is also facing resistance at the upper trendline showing that sellers booked profits when solana approached this level. IMG_8 the chaikin money flow (cmf) is not only positive but has also made a sharp move north. this shows strong bullish momentum as capital inflow to solana is high. the average directional index (adx) is also sloping upwards, an indication that the uptrend is gaining strength. as these bullish signals align, sol could aim for the next resistance level at $171. if it flips this level, sol will have broken out from the ascending parallel channel, paving the way for more gains. the bullish signs have also drawn the attention of long traders, as solana funding rates have been positive for two weeks. this shows that long buyers are willing to pay a fee to maintain their positions, which reinforces the bullish thesis. IMG_9 more articles IMG_10 by muthoni mary 34 mins ago IMG_11 1 hour ago IMG_12 by chanakya 2 hours ago IMG_13 by kamina gilani 3 hours ago IMG_14 by adewale olarinde IMG_15 by akashnath s 4 hours ago",178.png 179.png 180.png 181.png 182.png 183.png 184.png 185.png 186.png 187.png 188.png 189.png 190.png 191.png 192.png
