datetime,url,title,text,imgs
2024-10-24,https://ambcrypto.com/michael-saylor-clarifies-stance-on-bitcoin-custody-amid-community-backlash/,Michael Saylor clarifies stance on Bitcoin custody amid community backlash,"2min read how did the crypto community react to saylor’s latest comments? IMG_1 ishika kumari ann maria shibu posted: october 24, 2024 michael saylor reverses his stance after facing backlash for advocating big banks to oversee bitcoin custody. concerns rise over bitcoin’s centralization risk due to increasing institutional involvement. after facing widespread backlash from the crypto community, microstrategy founder michael saylor walked back his comments which suggested that large banks should oversee bitcoin [btc] custody. this stemmed from the ongoing concerns that such a move could lead to centralization and increase the risk of government intervention. michael saylor steps back from his earlier stance addressing these concerns, saylor clarified his position, asserting that individuals and institutions should have the autonomy to decide how they store and manage their btc holdings. in a 23rd october post on x, saylor stated, “i support self-custody for those willing & able, the right to self-custody for all, and freedom to choose the form of custody & custodian for individuals & institutions globally. #bitcoin benefits from all forms of investment by all types of entities, and should welcome everyone.” saylor, once celebrated for his personal bitcoin strategy and the massive investments made by his company microstrategy ,now finds his reputation under strain. for those unaware, saylor recently advocated for btc holders to trust large, “too big to fail” financial institutions, asserting that these entities are well-equipped to securely manage significant assets like bitcoin. this remark openly challenged saylor’s position, with ethereum co-founder vitalik buterin questioning the wisdom of relying on centralized institutions in a space built on decentralization. buterin said, “i’ll happily say that i think saylor’s comments are batshit insane. he seems to be explicitly arguing for a regulatory capture approach to protecting crypto.” mixed community reaction despite his attempts to resolve the recent controversy, saylor’s image seems to have taken a hit. remarking on the same, a crypto analyst pointed out, IMG_2 adding to the fray was another x user joel valenzuela who said, “capitulation. but you showed your true colors.” needless to say, the fallout has raised concerns over whether his once-solid pro-bitcoin image can fully recover. however many came in support of saylor. more articles by benjamin njiri 1 hour ago by ambcrypto team 2 hours ago by olivia stephanie 3 hours ago by gladys makena by ishika kumari 4 hours ago",84.png 85.png
2024-10-24,https://ambcrypto.com/bitcoin-network-turns-positive-a-bullish-signal-for-investors/,Bitcoin network turns positive: A bullish signal for investors?,"2min read bitcoin network growth showed remarkable expansion in october and might boost btc’s medium prospects. IMG_1 benjamin njiri ann maria shibu posted: october 24, 2024 btc ran up to $70k flipped network fundaments positive. is it a bullish signal despite the short-term correction and likely consolidation? bitcoin [btc] network fundamentals turned positive for the first time in october, on what an analyst deemed a positive signal for the asset in the medium term. bitcoin [btc] network fundamentals turned positive for the first time in october, on what an analyst deemed a positive signal for the asset in the medium term. according to cryptoquant, the positive network metrics were a familiar trend during bullish periods and suggested a likely positive outcome for the asset despite a likely correction or consolidation. following a recent run towards $70k, the 30-day average number of active btc addresses surged towards the 1 million mark. it hit levels last seen in june, indicating massive interest in the asset amid last week’s pump. IMG_2 a btc hike next? a similar positive trend was recorded across the mining segment and network fees. notably, the mining difficulty hit an all-time high, indicating intense competition for rewards among btc miners, a positive catalyst for btc’s intrinsic value. a similar positive trend was recorded across the mining segment and network fees. notably, the mining difficulty hit an all-time high, indicating intense competition for rewards among btc miners, a positive catalyst for btc’s intrinsic value. additionally, btc’s apparent demand, or difference between production and inventory schedule, surged to a 6-month high of 256k btc as of press time. in most cases, the spike in demand is always preceded by a btc price hike. IMG_3 despite the above positive catalysts, analysts had mixed btc price projections as the us elections edged closer. blockworks’ analyst felix jauvin cautioned that btc could be range-bound until the election was over. blockworks’ analyst felix jauvin cautioned that btc could be range-bound until the election was over. “nobody wants to be a marginal buyer of risk here this close to the election. probably just a whole lotta chop until it’s over….: another pundit, justin bennett, echoed his cautious sentiment, citing whales’ lack of interest in grabbing the recent mid-week dip. another pundit, justin bennett , echoed his cautious sentiment, citing whales’ lack of interest in grabbing the recent mid-week dip. since 17th october, whale vs. retail delta, which tracks whales’ positioning relative to retail traders, has declined, suggesting that whales trimmed exposure on btc. IMG_4 interestingly, options traders remained bullish, as seen by their increased buying of call options (bets that the btc price will rise) by election day. on the 22 october daily update, trading firm qcp capital noted, on the 22 october daily update, trading firm qcp capital noted , “short-term implied volatility is peaking at election day expiry, with a 10-vol spread over the prior expiry and skews favouring calls over puts, despite btc being about 8% below its all-time highs” more articles by ambcrypto team 1 hour ago by olivia stephanie 2 hours ago by gladys makena 3 hours ago by ishika kumari 4 hours ago by kelvin murithi 5 hours ago",86.png 87.png 88.png 89.png
2024-10-24,https://ambcrypto.com/is-india-banning-cryptos-heres-what-you-should-know/,Is India banning cryptos? Here’s what you should know!,"2min read india’s relationship with cryptos might write a new chapter soon. IMG_1 ambcrypto team jibin mathew george posted: october 24, 2024 some regulators believe “private cryptos” should be banned cbdcs continue to be supported by institutions in india india has had a complicated relationship with cryptocurrencies over the years. this relationship was in the spotlight recently after a local media report claimed that key regulators and institutions in the country are in favour of banning “private cryptos” like bitcoin and ethereum. according to hindustan times, these regulators believe that any advantages offered by the likes of the aforementioned “private cryptos” can be leveraged by the use of cbdcs. here, it’s worth noting that the aforementioned report made no mention of the officials in question or the institutions that share this point of view. hence, it’s difficult to ascertain how strongly the government itself feels about this proposition. right now, the indian government is preparing a discussion paper on the topic of cryptos, a paper that might possibly precede a legislation. while the government has chaired extensive rounds of consultations over the past few months, the consensus right now is that the risks of crypto-use outweigh its benefits. in fact, one official claimed, “cbdcs can do whatever cryptos do. in fact, cbdcs have more benefits than cryptos, minus the risks associated with private cryptocurrencies.” in light of the asset class’s growing popularity in the country, however, the indian government might choose to side with the likes of bitcoin and ethereum eventually though. also, regardless of its pov on cryptos, india has always looked positively at blockchain technology and its broader applications. lack of “institutional confidence” a reversal of the aforementioned consensus will depend on institutional confidence in the asset class. for example – the governor of the reserve bank of india has for long voiced concerns about cryptos and their volatility. like many who work with the government, shaktikanta das has often spoken highly of cbdcs, while also highlighting the possible risks associated with cryptos. india’s finance minister nirmala sitharaman holds similar opinions too. back in 2023, india adopted an imf-fsb synthesis paper that advised against an outright ban of cryptocurrencies. however, the paper in question also allows for flexibility to impose stricter regulations on this asset class. right now, it would seem that india is leaning towards that idea. crypto-entities feel the heat too! not just cryptos, but crypto-entities have been on the wrong side of the indian government too. consider the case of binance, for example. back in january 2024, india blocked access to the crypto-exchange’s app and platform, citing non-compliance with money laundering laws. this was reversed in august, however, not without binance first registering as a reporting entity with india’s financial intelligence unit (fiu). home terra luna classic lunc update: how a 15m token burn failed to offset price drop terra classic (lunc) burns 15 million tokens but faces price dip, declining open interest, and reduced volume. IMG_2 IMG_3 IMG_4 olivia stephanie ann maria shibu 15 million lunc tokens were burned, but the price fell 4.19% amid dropping market interest. futures open interest hit $9.27 million, marking a significant decline as trading volume plunged by 66.35%. terra luna classic [lunc] ecosystem is witnessing a mix of developments as price trends, token burns, and futures trading volume unfold. however, recent token burns and price actions suggest a potential shift in the market, but the latest price movement and open interest data indicate a complex situation. lunc price update and market activity terra classic (lunc) stands at $0.00009008 as of press time, reflecting a decline of 4.19% over the past 24 hours. the 24-hour trading volume for lunc is reported at $27,294,595. terra classic (lunc) stands at $0.00009008 as of press time, reflecting a decline of 4.19% over the past 24 hours. the 24-hour trading volume for lunc is reported at $27,294,595. over the past seven days, lunc has registered a modest increase of 0.37%, suggesting some stability in a largely volatile market. lunc’s circulating supply is estimated to be around 5.7 trillion, bringing its market capitalization to approximately $513.1 million. IMG_5 tradingview this price movement comes after a burn of 15 million lunc tokens on 22nd october, part of ongoing efforts to reduce supply and potentially drive price growth. this price movement comes after a burn of 15 million lunc tokens on 22nd october, part of ongoing efforts to reduce supply and potentially drive price growth. while the deflationary approach aims to increase value over time, the immediate impact has been limited, as shown by the recent drop in price. technical analysis: ascending support and resistance levels the lunc price chart shows an ascending trendline, indicating an ongoing attempt by bulls to push the price higher. the trendline has provided support over recent weeks, creating higher lows. if the price maintains this upward trajectory, it could signal further bullish momentum. key resistance is noted at the $0.00012740 level, which represents the next target for a potential breakout. a successful breach of this level could lead to further price gains, provided buying pressure sustains. IMG_6 on the downside, support levels are identified at $0.00008850 and $0.00006390. these levels could act as cushions in the event of a price dip, particularly if the ascending trendline fails to hold. a fall below these support levels might indicate a bearish trend reversal. futures market: declining open interest and volume the lunc futures market has shown a notable decline in open interest, which currently stands at $9.27 million, down 4.68% from recent levels, according to coinglass data. the lunc futures market has shown a notable decline in open interest, which currently stands at $9.27 million, down 4.68% from recent levels, according to coinglass data . this decrease in open interest aligns with a broader trend observed over the past year. open interest peaked at nearly $100 million in september 2022 before trending downward. lower open interest suggests a decrease in market participation, potentially reducing volatility in the short term. IMG_7 is your portfolio green? check the lunc profit calculator additionally, volume in the lunc futures market has dropped by 66.35%, reaching $10.45 million. this reduction indicates reduced speculative interest, which may be due to various factors, including current price stability and market sentiment. more articles by benjamin njiri 58 mins ago by olivia stephanie 2 hours ago by ambcrypto team by gladys makena 3 hours ago by ishika kumari 4 hours ago by kelvin murithi 5 hours ago",90.png 91.png 92.png 93.png 94.png 95.png 96.png
2024-10-24,https://ambcrypto.com/lunc-update-how-a-15m-token-burn-failed-to-offset-price-drop/,LUNC update: How a 15M token burn failed to offset price drop,"2min read terra classic (lunc) burns 15 million tokens but faces price dip, declining open interest, and reduced volume. IMG_1 olivia stephanie ann maria shibu posted: october 24, 2024 15 million lunc tokens were burned, but the price fell 4.19% amid dropping market interest. futures open interest hit $9.27 million, marking a significant decline as trading volume plunged by 66.35%. terra luna classic [lunc] ecosystem is witnessing a mix of developments as price trends, token burns, and futures trading volume unfold. however, recent token burns and price actions suggest a potential shift in the market, but the latest price movement and open interest data indicate a complex situation. lunc price update and market activity terra classic (lunc) stands at $0.00009008 as of press time, reflecting a decline of 4.19% over the past 24 hours. the 24-hour trading volume for lunc is reported at $27,294,595. terra classic (lunc) stands at $0.00009008 as of press time, reflecting a decline of 4.19% over the past 24 hours. the 24-hour trading volume for lunc is reported at $27,294,595. over the past seven days, lunc has registered a modest increase of 0.37%, suggesting some stability in a largely volatile market. lunc’s circulating supply is estimated to be around 5.7 trillion, bringing its market capitalization to approximately $513.1 million. IMG_2 tradingview this price movement comes after a burn of 15 million lunc tokens on 22nd october, part of ongoing efforts to reduce supply and potentially drive price growth. this price movement comes after a burn of 15 million lunc tokens on 22nd october, part of ongoing efforts to reduce supply and potentially drive price growth. while the deflationary approach aims to increase value over time, the immediate impact has been limited, as shown by the recent drop in price. technical analysis: ascending support and resistance levels the lunc price chart shows an ascending trendline, indicating an ongoing attempt by bulls to push the price higher. the trendline has provided support over recent weeks, creating higher lows. if the price maintains this upward trajectory, it could signal further bullish momentum. key resistance is noted at the $0.00012740 level, which represents the next target for a potential breakout. a successful breach of this level could lead to further price gains, provided buying pressure sustains. IMG_3 on the downside, support levels are identified at $0.00008850 and $0.00006390. these levels could act as cushions in the event of a price dip, particularly if the ascending trendline fails to hold. a fall below these support levels might indicate a bearish trend reversal. futures market: declining open interest and volume the lunc futures market has shown a notable decline in open interest, which currently stands at $9.27 million, down 4.68% from recent levels, according to coinglass data. the lunc futures market has shown a notable decline in open interest, which currently stands at $9.27 million, down 4.68% from recent levels, according to coinglass data . this decrease in open interest aligns with a broader trend observed over the past year. open interest peaked at nearly $100 million in september 2022 before trending downward. lower open interest suggests a decrease in market participation, potentially reducing volatility in the short term. IMG_4 is your portfolio green? check the lunc profit calculator additionally, volume in the lunc futures market has dropped by 66.35%, reaching $10.45 million. this reduction indicates reduced speculative interest, which may be due to various factors, including current price stability and market sentiment. home altcoin prove ai’s migration from casper network to hedera is a sign of… prove ai's migration from casper network to hedera is a sign of... hedera has emerged as a popular destination for projects intending to migrate. IMG_5 IMG_6 IMG_7 ambcrypto team jibin mathew george prove ai ag, formerly known as casper labs, made a “strategic decision” to move this is just the latest update in the ongoing trend of industry-wide migration prove ai ag, a firm specializing in ai governance, is set to migrate its flagship governance solution from the casper network to the hedera network. this move underscores the increasing trend of blockchain projects shifting to networks that offer enhanced technological capabilities. hedera’s advanced blockchain infrastructure, characterized by high throughput, low latency, and robust security, has emerged as a favored choice for projects seeking a more reliable and auditable ecosystem. for prove ai ag, the migration is particularly strategic as it aims to enhance the security of its ai training data and ensure more transparent governance protocols. a broader strategy the shift to hedera is part of prove ai’s broader strategy to align with blockchain networks that can support the growing demands of ai governance. hedera’s design—using the hashgraph consensus mechanism—enables efficient processing of large data volumes, a crucial aspect for ai training environments where accuracy and auditability are paramount. according to charles adkins, president at hedera, “prove ai, as an immutable, tamper-proof database, brings a level of trust to risk management in ai systems, which aligns perfectly with our mission to provide a secure, scalable foundation for builders and enterprises alike.” not an isolated event this migration is not an isolated event though. in recent years, hedera has witnessed a surge in interest from various projects looking for an efficient and secure blockchain environment. for instance, the popular nft project mynt also made a similar transition to hedera, capitalizing on its high throughput and energy efficiency. projects like mynt have highlighted hedera’s suitability not just for ai governance but also for broader applications like tokenization, digital assets, and decentralized finance (defi). hedera’s recent launch of a toolkit for on-chain tokenization has further cemented its reputation as a versatile blockchain network. this toolkit facilitates the seamless integration of real-world assets into the blockchain, enabling more transparency, accessibility, and liquidity. the trend of migrating from one blockchain to another is becoming more common, driven by evolving needs around scalability, security, and cost efficiency. for example, projects that started on ethereum have migrated to networks like polygon or solana due to lower transaction costs and faster processing speeds. prove ai ag’s decision to migrate to hedera is thus part of a broader pattern of strategic shifts in the blockchain industry. IMG_8 IMG_9 IMG_10 more articles by benjamin njiri 15 mins ago by ambcrypto team 45 mins ago 2 hours ago by gladys makena by ishika kumari 3 hours ago by kelvin murithi 4 hours ago",97.png 98.png 99.png 100.png 101.png 102.png 103.png 104.png 105.png 106.png
2024-10-24,https://ambcrypto.com/prove-ais-migration-from-casper-network-to-hedera-is-a-sign-of/,Prove AI’s migration from Casper Network to Hedera is a sign of…,"2min read hedera has emerged as a popular destination for projects intending to migrate. IMG_1 ambcrypto team jibin mathew george posted: october 24, 2024 prove ai ag, formerly known as casper labs, made a “strategic decision” to move this is just the latest update in the ongoing trend of industry-wide migration prove ai ag, a firm specializing in ai governance, is set to migrate its flagship governance solution from the casper network to the hedera network. this move underscores the increasing trend of blockchain projects shifting to networks that offer enhanced technological capabilities. hedera’s advanced blockchain infrastructure, characterized by high throughput, low latency, and robust security, has emerged as a favored choice for projects seeking a more reliable and auditable ecosystem. for prove ai ag, the migration is particularly strategic as it aims to enhance the security of its ai training data and ensure more transparent governance protocols. a broader strategy the shift to hedera is part of prove ai’s broader strategy to align with blockchain networks that can support the growing demands of ai governance. hedera’s design—using the hashgraph consensus mechanism—enables efficient processing of large data volumes, a crucial aspect for ai training environments where accuracy and auditability are paramount. according to charles adkins, president at hedera, “prove ai, as an immutable, tamper-proof database, brings a level of trust to risk management in ai systems, which aligns perfectly with our mission to provide a secure, scalable foundation for builders and enterprises alike.” not an isolated event this migration is not an isolated event though. in recent years, hedera has witnessed a surge in interest from various projects looking for an efficient and secure blockchain environment. for instance, the popular nft project mynt also made a similar transition to hedera, capitalizing on its high throughput and energy efficiency. projects like mynt have highlighted hedera’s suitability not just for ai governance but also for broader applications like tokenization, digital assets, and decentralized finance (defi). hedera’s recent launch of a toolkit for on-chain tokenization has further cemented its reputation as a versatile blockchain network. this toolkit facilitates the seamless integration of real-world assets into the blockchain, enabling more transparency, accessibility, and liquidity. the trend of migrating from one blockchain to another is becoming more common, driven by evolving needs around scalability, security, and cost efficiency. for example, projects that started on ethereum have migrated to networks like polygon or solana due to lower transaction costs and faster processing speeds. prove ai ag’s decision to migrate to hedera is thus part of a broader pattern of strategic shifts in the blockchain industry. more articles IMG_2 by benjamin njiri 2 mins ago IMG_3 by ambcrypto team 32 mins ago IMG_4 by olivia stephanie 1 hour ago IMG_5 by gladys makena 2 hours ago IMG_6 by ishika kumari 3 hours ago IMG_7 by kelvin murithi 4 hours ago",107.png 108.png 109.png 110.png 111.png 112.png 113.png
